id,title,text,subreddit,score,num_comments
11hz7sz,"Queste, credo, sono le incombenti ed inquietanti svolte socio-antropologiche... articolo del Maestro Franco Bertossa dalla pagina Facebook","Queste, credo, sono le incombenti ed inquietanti svolte socio-antropologiche:

l’”utero in affitto”
la bioingegneria su ogni vivente e sull’umano
la fantasia nella costituzione dei nuclei familiari
la violazione costituzionale di ogni privacy
la realtà virtuale surrogante vieppiù la vita reale

Volevo aprire un tema che fu vivido nella riflessione filosofica del '900, quello della Tecnica.

Jünger sollevò la questione e Heidegger la riprese e approfondì.

Cito una frase di Heidegger che mi colpì molto:

« L'essenza più profonda della tecnica non è nulla di tecnico. »

L'oblio della Differenza, in primo luogo tra ente e niente e, in secondo, tra essere e ente (Ereignis), riduce il rapporto dell' ""esserci umano"" al solo ente - tutto è ente - e dunque all'oggettivazione.

L'uomo decade a cosa tra le cose, a oggetto, a organismo la cui essenza si comprende totalmente con la riduzione a numero, misura e calcolo.

L'uomo è così visto ed inteso esclusivamente come un organismo, una super macchina.

Oggi vige tale visione dell'uomo.

Poiché i filosofi non sembrano in grado di pronunciare la argomentazione decisiva in grado di sfatare la suddetta visione, vince l'efficacia esplicativa della più rigorosa via di studio dell'oggettivo: la scienza.

Heidegger fa osservare, inoltre, che la scienza patisce dell'indirizzo impostole dalla tecnica in quanto capace, quest'ultima, di produrre l'amplificazione sensoriale attraverso la strumentazione (microscopio, telescopio, ecc).

Non dunque la scienza orienta e dirige la tecnica, ma la tecnica orienta e dirige la scienza.

Ed eccoci nel pieno dominio della tecnica scientifica.

Heidegger aggiunge: ""Non sono in opposizione alla Tecnica, bensì mi chiedo della sua essenza.""

Giungerà a suggerire di viverla nell'abbandono (Gelassenheit) in quanto essa è solo una voce del Destino dell'essere.

Destino significa che l''essere (Sein) si dà (Es gibt) nelle varie epoche secondo modi svelanti e oscuranti la verità dell'essere stesso.

Vi furono epoche in cui l'essere si svelò all'esserci umano con maggior veridicità - da Parmenide, Eraclito, fino alla svolta socratica - e altre in cui dominò l'oblio, vale a dire in cui l'uomo si rapportò solo con l'ente e mai col niente.

Tale epoca oscura iniziò, secondo Heidegger, col Platone del Mito della caverna, ovvero da quando l'uomo si indirizzò al fenomeno oggettivandolo e staccandolo da sé nell'idea.

Via via, nei secoli, la domanda nata con Platone e Aristotele - che cos'è l'ente, fondamentalmente? - trovò risposte quali ""l'ente è idea, enérgheia, sostanza, creazione, attività dell'Io/spirito, volontà, realtà razionale, materia, fenomeno, produzione, ecc."".

Ma già dopo Nietzsche, dice Heidegger, la domanda cominciò a cambiare: nacque la domanda circa il senso dell'essere.

Fu una meravigliosa stagione che in parte ho vissuto e che, a mio avviso, tramontò con la morte di Sartre, nel 1980.

Dopo di allora le efficaci spiegazioni naturalistiche della scienza, soprattutto delle nascenti neuroscienze, aggredirono le posizioni idealiste, fenomenologiche ed esistenzialiste.

Citando me stesso: l'uomo, oggi, pare non saper più cosa pensare del fatto che pensa.

Avendo perso la relazione cogente con l'a priori trascendentale (Kant) o con la natura originaria ed irriducibile del fenomeno (Husserl) o col Da-sein (esser-ci) heideggeriano, l'uomo rimane con la sola relazione oggettivante, là dove anche il soggetto non è altro che un oggetto particolare denominato ""soggetto"".

Altro tesoro che l'uomo contemporaneo ha perduto è il riconoscimento del prezioso messaggio heideggeriano: lo svelamento dell'essere si dà attraverso le ""tonalità emotive"", le Stimmung.

Sentire emotivamente, allorché molto profondo ed originario, svela la verità dell'essere: l'angoscia esistenziale, lo stupore, la meraviglia, il senso del monstrum, lo stranimento, il ritegno, lo spaesameneto, il panico.. ma anche la poesia, la bellezza ed il senso del sacro.

L'aver perso tale consapevolezza ha portato alle posizioni, che trovo spesso inquietanti, delle via via nuove generazioni le quali paiono essere indifferenti alle voci del sentire originario reclamanti un ritorno all'ascolto della Verità.

Oggi si vuole che il sentire sia interamente riducibile allo statuto di fitness evolutiva di un organismo cresciuto via via in complessità.

Io contesto queste posizioni e dichiaro di essere in grado di mettere in crisi seria e irreversibile chiunque le sostenga.

Occorre, però, che ci guardiamo occhi negli occhi, mentre dialoghiamo.

Lo scritto non basta.

L'odierna dominante visione - scientifico-tecnica - che vuole INTERAMENTE leggere e ridurre l'esperienza umana alla complessità del comportamento materiale, è superstiziosa né più né meno di quanto essa stessa consideri la stregoneria.

Poiché SO che la visione oggettivante non può portare alla piena comprensione e valorizzazione dell'esperienza umana, temo che l'uomo vi si consegni totalmente.

Le conseguenze sarebbero nefaste quanto lo sono state quelle derivanti da fantasie superstizionse di natura religiosa, mitologica, magica, dei tempi di cui abbiamo ricordo.

Occorre una ""via di mezzo"" che sognò anche Heidegger.
Non potrà essere universale, perché l'umanità non è mai omogenea nei confronti di tale questione, ma sarebbe utile e sensato che almeno una voce autorevole e potente continuasse a farsi sentire attraverso le generazioni.

…
Non ho la risposta definitiva ai punti problematici che ho esposto all'esordio, ma so che non possono essere affrontati e trattati ignorando la natura assoluta dell'esperienza umana.

Della tua.

…
Franco Bertossa
…",BuddhismoEuropeo,1,0
1g557bv,La gestazione per altri diventa reato universale in Italia,,italy,325,323
1c28zi5,"Meloni: 'L'utero in affitto pratica disumana, presto reato universale'",,Italia,64,252
1g89szv,"Che tempo che fa - Luciana: ""Scusa Melons, l'utero in affitto è reato universale o lo è solo per chi non è amico tuo?"" ",,TVItaliana,10,1
1hh1yrb,Adesso pure la cortesia verso gli altri è scambiata per razzismo?,"Stamattina sono andato in posta a pagare un bollettino iren per la gelateria e bla bla ba.... non entriamo nel dettaglio

Dopo essere entrato e aver prenotato via app, anche se la posta era vuota ho dovuto aspettare.

Nel mentre che aspettavo entrano due persone di colore, madre e padre (con annesso il figlio). Io ero seduto su una fila da 3 sedie, e altre non ce n'erano. Quindi per buon gesto faccio cenno alla signora di prendere il mio posto e io rimanevo in piedi (e il padre si sedeva nell'altra sedia rimasta da prima libera, la terza sedia invece era occupata da un'altra persona)

Faccio cenno e nemmeno il tempo di fiatare che la madre mi guarda strano, il padre se ne va per i fatti suoi facendo palesemente finta di niente e la madre mi dice in italiano letteralmente ""Voi italiani siete tutti come quello che c'era nella seconda guerra mondiale""

Ok va bene? Cioè... se vuoi credere che sono un razzista solo perchè ho fatto cenno a te e a quello che presumevo essere il padre (perchè siete entrati assieme) di sedervi, lasciando il posto a te con un figlio appena nato e al padre che poteva starti vicino anzichè andare dall'altro lato dell'italia...

Boh non lo so... ormai la cordialità è vista alla pari di una cosa non cordiale o di un reato universale",Italia,301,185
1c6ken7,Quale partito politico dovrei votare alle elezioni europee di giugno?,"Scrivo questo post per capire quale partito politico votare nelle elezioni europee che ci saranno a giugno.

Allo stato attuale non riesco a trovare un partito che rappresenti le mie idee politiche, che non sono facilmente catoligabili in ""destra"" o ""sinistra"". Per alcune cose sono un conservatore, per altre un progressita. 

Il post sarà parecchio lungo, si tratta di una mega riassunto delle mie posizioni politiche.

In tutta sincerità uso un account nuovo perché non voglio che mettiate in relazione le cose che dirò adesso con tutti i commenti che ho fatto fino ad ora.

Dal punto di vista economico, sono per il libero mercato ma credo che le persone più povere debbano essere aiutate dallo stato. Sono a favore di una tassazione progressiva, e questo mi collocherebbe a sinistra (ma non troppo, dato che sono a favore del libero mercato). Comunque credo che il fatto che le persone non muoiano di fame non sia solo giusto nei loro confronti (e questo è il discorso principale), ma sia anche una necessità per l'ordine pubblico e per la sicurezza pubblica, perché maggiore povertà può significare maggiore criminalità. Credo quindi che sia un discorso che potrebbe avere un senso anche in una prospettiva di destra.

Sono abbastanza conservatore sui temi dei diritti civili e sulle questioni del  femminismo/LGBTQ+. Credo che il movimento femminista abbia decisamente oltrepassato quelli che potevano essere i confini di una rivendicazione normale e legittima. Il dibattito su questi temi è incredibilmente polarizzato per colpa delle attiviste di questo movimento, che non hanno fatto altro che alzare sempre più il tiro arrivando a dire cose che sfiorano i limiti dell'assurdo. Non credo che la nostra società sia patriarcale nè che le donne siano svantaggiate rispetto agli uomini. Per quello che riguarda le questioni LGBT, in realtà sono a favore dei matrimoni gay e della possibilità da parte loro di adottare figli. Ma è evidente che anche in questo caso si è andati ben oltre i confini di una rivendicazione sensata. Si parla di cambiare sesso ai bambini, cosa che reputo un'assurdità, tra l'altro adesso è uscito un rapporto (il [Rapporto Cass](https://www.ilpost.it/2024/04/12/rapporto-cass-disforia-di-genere/) ) che mette in dubbio la solidità scientifica degli studi che proverebbero l'efficacia delle terapia ormonali e dei bloccanti della pubertà per il benessere del bambino. Sono contro la legalizzazione delle droghe leggere, per me la droga è soltanto una piaga sociale, la droga leggera è meno pericolosa ma lo è comunque in una certa misura, e gli effetti negativi delle droghe leggere sono spesso sottovalutati. Sono contro l'utero in affitto, ma non sono particolarmente appassionato al dibattito di farne un reato universale.

Sul cambiamento climatico ho idee di sinistra nel senso che penso che sia causato dall'uomo e che sia un problema serio che dobbiamo risolvere. Però penso anche che i gruppi come Extinction Rebellion e Ultima Generazione adottino dei metodi di lotta poco condivisibili e anche controproducenti, e che rischiano soltanto di far allontanare le persone dal riconoscimento dell'importanza di questo problema.

Ovviamente non sono antivaccinista, anzi non penso che la politica del green pass avesse nulla di sbagliato. Considero gli antivaccinisti e le persone che fanno discorsi di questo tipo semplicemente dei cretini (e qui ""destra"" e ""sinistra"" non c'entrano nulla).

Di principio, sono abbastanza d'accordo all'idea di una Unione Europea. Ovviamente è interesse di tutti i paesi membri essere all'interno di una comunità, e credo che se l'Italia stesse da sola conterebbe molto di meno. Tuttavia, credo anche che l'Unione Europea così come è adesso faccia un po' schifo, che sia un progetto che non sa bene in che direzione vuole andare. Sarei anche d'accordo ad una maggiore integrazione europea, e anche ad un esercito unico europeo, ma è evidente che l'Unione Europea non è pronta per tutto ciò, e non lo è da 20 anni. Sembra un progetto che non porta a nulla, tra l'altro il livello della classe dirigente europea è pessimo. Inoltre, fa davvero ridere che in queste due guerre in Ucraina e in medio oriente l'Unione Europea conti come il due di picche, nonostante sia il gigante geopolitico geograficamente più vicino ad esse. Sembra strano dirlo, ma l'impressione è che in queste due guerre conti più la mediazione della Turchia, piuttosto che dell'Unione Europea. Insomma: Unione Europea sì, ma in un altro modo.

Credo che il problema principale dell'Italia sia la bassa natalità, e che una buona parte degli altri problemi derivino da questo. Il fatto che ci siano così pochi soldi, e che quindi si sia costretti a fare tagli a istruzione e sanità, deriva da questo: una bassa natalità significa tanti vecchi a cui dover pagare la pensione e poche persone che sono in età lavorativa. L'argomento per cui le persone non fanno figli perché non hanno stabilità economica è anche giusto, ma è evidente che si tratta di un circolo vizioso, perché a sua volta il fatto che non si fanno figli è un problema per l'economia. Credo che ultimamente si sia diffusa una cultura anti-natalista un po' ridicola, e in palese contrasto con il bene della nostra nazione (che è appunto che aumenti la natalità). Non sto dicendo che la gente deve essere obbligata a fare figli (io stesso non li voglio fare, per motivi personali), dico che non capisco tutta questa necessità a sottolineare ogni due secondi che non fare figli è una scelta di cui andare fieri, e che chi non ne fa nella nostra società viene discriminato. Non penso che sia vero, e non riesco a trovare un esempio concreto di questa discriminazione. Una natalità adeguata è una esigenza per il genere umano e per l'economia, se hai deciso di non fare figli hai tutto il diritto di non farli, ma almeno mantieni un comportamento normale e non fare storie credendo non si sa per quale motivo di essere discriminato. Comunque, una soluzione al problema della natalità potrebbe essere continuare ad accogliere i migranti che stanno venendo in Italia e integrarli nella nostra società, senza sfruttarli come spesso facciamo. Non credo che questo sia in grado di compensare completamente la bassa natalità, ma di sicuro darebbe una mano. Sul tema della immigrazione ho idee abbastanza di sinistra, anche se è ovvio che le persone che vengono dall'Africa hanno un tasso di criminalità maggiore rispetto alla popolazione italiana. Credo però che l'unico modo per ridurre questo tasso di criminalità sia integrarli, cercando inoltre di farli uscire dalla loro condizione di povertà. Non penso che ci sia un'altra strada, anche perché i flussi migratori non li puoi fermare.

Cambiando discorso, credo che la nostra società abbia un serio problema con il suo sistema di informazione, che spesso si concentra su cose secondarie e tralascia quelle importanti. Ricordo quando, qualche settimana fa, non si faceva altro che parlare del fatto che Calenda forse aderiva al campo largo: si parlava più di questo che della guerra in Ucraina e di quella in medio oriente. Oppure, non ho mai capito perché qualche anno fa siamo stati per due settimane a discutere del fatto che Grillo aveva detto che bisogna andare a riparare i tombini. Tutti ciò non ha alcun senso. Spesso questo problema è legato al tema della ""discriminazione"", per cui l'opinione pubblica si concentra su un contenuto o su un fatto che sarebbe discriminatorio verso qualche minoranza o categoria di persone, quando in realtà si tratta di un fatto secondario che non merita tutta quella attenzione, e la presunta discriminazione è in realtà poco rilevante se non proprio inesistente. È il caso di quella pubblicità della Esselunga sul divorzio, che ho guardato tipo 10 volte e non ho ancora capito che cosa avesse di sbagliato. Di contro, alcune discriminazione reali e gravi che accadono nel nostro paese vengono invece totalmente ignorate. Le persone nelle nostre carceri stanno spesso in una condizione orribile, ma di questo non frega un cazzo a nessuno. Il fatto che le persone con disabilità in sedia a rotelle non possano accedere a moltissimi edifici è una cosa che sappiamo tutti, ma non se ne discute, non nascono dibattiti come quello della pubblicità della Esselunga, nonostante sia mille volte più importante. Tutto ciò è ingiusto verso i disabili, io se lo fossi sarei incazzato a morte. Dovremmo imparare a concentrarci sulle cose importanti, la maggior parte delle discussioni che si sono create negli ultimi anni (come quella della Esselunga) sono delle stupidaggini. Per non parlare delle discussioni interminabili sul fatto che un certo personaggio pubblico ha detto una singola frase un po' controversa e un po' sessista. Tutto ciò non dovrebbe avere alcuno spazio nel dibattito pubblico, e il fatto che lo abbia è davvero un cattivo segno, sta a indicare la nostra totale  incapacità di individuare i problemi davvero importanti.

Sulla politica estera ho idee un po' contrastanti. Da un lato sono critico verso l'atteggiamento dell'occidente, che pur essendo democratico spesso ha una politica estera più aggressiva dei paesi non democratici, soprattutto gli Stati Uniti. È ovvio che su questo tema abbiamo dei bias grandi come una casa: ad esempio, condanniamo giustamente quello che sta facendo Putin in Ucraina, ma non abbiamo condannato altrettanto fermamente quello che hanno fatto gli Stati Uniti in Iraq. Tra le due cose non c'è davvero alcuna differenza, l'unica è che gli USA stanno dalla nostra parte. Nonostante questo, credo che abbandonare l'alleanza con gli USA e guardare all'oriente (ad esempio alla Cina) sia semplicemente una follia: non ci conviene, semplicemente. Inoltre, io condivido i valori democratici dell'occidente e non delle autocrazie come quella russa o cinese. Forse come occidente dovremmo imparare a darci una regolata nella politica estera, e che il fatto di essere democratici non ci dà il diritto di spadroneggiare in giro per il mondo come abbiamo sempre fatto. Anzi, in un certo senso dovrebbe essere il contrario: se ritieni di essere moralmente più avanzato in quanto democratico, dovresti dimostrarlo anche in politica estera cercare di avere un comportamento corretto. Detto questo, sono a favore dell'invio di armi all'Ucraina, una paese aggredito che ha bisogno di aiuto per difendersi contro Putin. Se è per questo sono anche a favore dell'aumento della spesa militare italiana, perché non è da escludere che in un futuro si arrivi allo scontro con Putin, purtroppo. Non sono a favore a dare alcun tipo di aiuto ad Israele, nè supporto morale, né di stare dalla sua parte in alcun modo. Israele è uno stato criminale, come è criminale quello che sta facendo a Gaza. Purtroppo il nostro collocamento di alleanze fa sì che sia nostro alleato (in quanto alleato degli USA), ma io non voglio avere nulla da spartire con quello stato. Io sono contro tutti gli aggressori: sono contro quel criminale di Putin, ma sono anche contro quel criminale di Netanyahu, e non vedo alcuna differenza tra i due. Sarebbe bello se l'occidente scaricasse completamente Israele. La comunità internazionale dovrebbe intervenire e impedire ad Israele di fare quello che sta facendo a Gaza, e Netanyahu e i suoi ministri dovrebbero essere processati per aver compiuto un massacro.

Alla luce di tutte queste cose che ho detto, quale partito dovrei votare?",Italia,0,19
1ado665,italia e gpa fatta all'estero,"come è andata a finire ?

adesso le persone che ricorrono a gpa, si ritrovano sbattutte in carcere una volta tornate in italia ?

o alla fine il tutto si risolve in un nulla di fatto, magari dovendoci essere pure la collaborazione dello stato straniero che ritiene la pratica legale sul suo territorio ?

portogallo, cipro e grecia sono 3 paesi all'interno dell'unione europea, che hanno reso legale la gpa.

sarebbe il colmo venire perseguiti per qualcosa fatto in un altro stato dell'unione.

le news italiane continuano a parlare di russia/ucraina e di recente israele/palestina, non c'è stato invece nessun approfondimento su ciò che avrebbe comportato l'approvazione del senato della gpa come reato universale.

ci saranno coppie italiane decise a servirsi della gpa all'estero dopo l'emendamento di legge del 2023 ?",Italia,1,0
19287wd,"Papa Francesco: «La maternità surrogata è una pratica deprecabile, ne auspico la proibizione a livello universale»",https://roma.corriere.it/notizie/cronaca/24_gennaio_08/il-papa-agli-ambasciatori-presso-la-santa-sede-il-mondo-alle-soglie-di-un-conflitto-globale-no-alla-maternita-surrogata-sia-vietata-ovunque-db8d7c8f-e9ac-4e22-b75d-2d4e55853xlk.shtml,NotizieInteressanti,1,0
166c5p3,Tornare padroni a casa nostra. Uscire dalla Convenzione europea dei diritti dell’uomo. «L’Italia non può rifiutarsi di riconoscere i bimbi nati con maternità surrogata»,[https://www.corriere.it/cronache/23\_agosto\_31/cedu-l-italia-non-puo-rifiutarsi-riconoscere-bimbi-nati-maternita-surrogata-a6ef84d4-47f6-11ee-9f25-836bb120d659.shtml](https://www.corriere.it/cronache/23_agosto_31/cedu-l-italia-non-puo-rifiutarsi-riconoscere-bimbi-nati-maternita-surrogata-a6ef84d4-47f6-11ee-9f25-836bb120d659.shtml),NotizieInteressanti,1,0
14g3mma,"Così adesso i giornalisti di La Repubblica la smettono di rompere. Maternità surrogata, Strasburgo dà ragione all’Italia e boccia il ricorso di coppie omosessuali ed eterosessuali: “C’è l’adozione”",https://www.repubblica.it/cronaca/2023/06/22/news/maternita_surrogata_corte_europea_diritti_umani-405368820/?ref=RHLF-BG-I405371120-P9-S1-T1,NotizieInteressanti,1,0
14g0ivr,"Maternità surrogata, Strasburgo dà ragione all’Italia e boccia il ricorso di coppie omosessuali ed eterosessuali: “C’è l’adozione”",https://www.repubblica.it/cronaca/2023/06/22/news/maternita_surrogata_corte_europea_diritti_umani-405368820/?ref=RHLF-BG-I405371120-P7-S1-T1,NotizieInteressanti,1,0
13x8iq7,"Maternità surrogata. ""Un giorno è venuto da me un uomo di 74 anni e mi ha detto: 'Mi risposo, mia moglie è giovane e voglio un figlio'. Ma ci sono donne anziane che hanno mariti giovani e vogliono un figlio per diffondere il loro Dna. Cosa facciamo? Neghiamo loro la realizzazione di un sogno?"".",https://www.repubblica.it/politica/2023/06/01/news/new_york_maternita_surrogata_come_funziona-402696921/?ref=RHLF-BG-I402722015-P6-S1-T1,NotizieInteressanti,1,0
