id,title,text,subreddit,score,num_comments
1g6bqzb,"La maternità surrogata diventa “reato universale” punibile anche se realizzata all’estero. Via libera dal Senato, il testo ora è legge",,oknotizie,103,202
15ahvqw,Maternità surrogata reato universale: il sì della Camera alla proposta di legge,,italy,188,506
1g57ubb,La maternità surrogata è reato universale. L'avvocata Gallo: «L’effetto sarà solo negativo: i figli potrebbero rimanere fantasmi e senza diritti». Cosa prevede la legge,,Italia,149,61
15adt2f,"Maternità surrogata, via libera della Camera alla legge sul reato universale. Il testo passa al Senato - Il Fatto Quotidiano",,Italia,1,2
621dmp,Una legge e un'etica laica sulla maternità surrogata,,italypremium,1,0
60v4id,Una legge e un'etica laica sulla maternità surrogata,,italypremium,1,0
16kfloa,Nuovi referendum (2024),"Si stanno raccogliendo firme online tramite SPID per indire referendum abrogativi su diverse questioni:
1. Abolizione del decreto rave
2. Obbligo raccolta firme anche per partiti già in Parlamento
3. Abolizione limite di tre mesi per la raccolta firme per referendum abrogativi
4. Abbassamento dal 3% all'1% della soglia di sbarramento per la Camera
5. Ncc: abrogazione obbligo di rimessa
6. Abrogazione del divieto sulla gpa (maternità surrogata)
7. Abrogazione della legge Merlin (legalizzazione delle ""case chiuse"", ossia adibite alla prostituzione)
8. Legalizzazione della cannabis (4 quesiti)
9. Ius soli
10. Semplificazioni per i contratti per lavoratori stranieri
11. Cittadinanza per decreto del Presidente della Repubblica

È richiesto un piccolo contributo (1,65€) che copre le spese del comitato promotore (che non ha alle spalle partiti) e che consente di firmare da 1 a tutti i quesiti che volete",italy,93,99
1g58mca,La maternità surrogata è reato universale: il sì definitivo al Senato,"Con il via libera del Senato, la «gestazione per altri» diventa di fatto un reato universale: le coppie italiane che faranno ricorso alla pratica nei Paesi in cui è consentita, saranno puniti comunque. È una norma di un solo articolo, che prevede che la maternità surrogata sia un reato anche se commessa all’estero e che quindi «il cittadino italiano è punito secondo la legge italiana». La maternità surrogata (o gestazione per altri) è una tecnica di fecondazione assistita in cui una donna porta avanti una gravidanza per conto di altri, ricevendo un compenso. In Italia la gestazione per altri era già vietata dalla legge 40 del 2004 sulla procreazione medicalmente assistita, che punisce «con la reclusione da tre mesi a due anni e con la multa da 600.000 a un milione di euro» chiunque la «realizza, organizza o pubblicizza» la maternità surrogata, ma molte coppie italiane vanno a farla all’estero, nei Paesi in cui è consentita. La maggioranza di governo ha presentato una proposta di legge per renderla reato universale, cioè perseguibile dalla giustizia italiana anche se viene fatta all’estero  https://roma.corriere.it/notizie/politica/24_ottobre_16/la-maternita-surrogata-e-reato-universale-il-si-definitivo-al-senato-14e94f60-8632-42bd-9c13-bc8f0b44bxlk.shtml",CasualIT,8,4
15ashz5,Santanché - Italia in Fiamme - Maternità Surrogata - Hunter Biden [RANT],"Benvenuti all'inferno anche oggi.

La politica è letteralmente infuocata tra caso Santanchè, il cui voto di [sfiducia](https://stream24.ilsole24ore.com/video/italia/santanche-misiani-non-esce-rafforzata-non-demordiamo/AFdFQSM) al Senato è fallito anche grazie all’astensione del Terzo Polo, e l’emergenza climatica. Quest’ultimo dibattito si dispiega tra negazionisti, tra cui lo stesso [compagno](https://www.ilfattoquotidiano.it/2023/07/21/giambruno-e-il-clima-lo-show-negazionista-del-compagno-di-meloni-che-interrompe-la-sua-cronista-che-ricorda-i-dati-scientifici/7237256/) della Premier, il ministro Musumeci che invece parla di [tropicalizzazione](https://www.lapresse.it/politica/2023/07/26/crisi-climatica-in-cdm-musumeci-tropicalizzazione-in-italia/) del Paese a seguito dei disastri che lo stanno flagellando, ed infine proprio Giorgia Meloni che ha [promesso](https://ilmanifesto.it/un-piano-idrogeologico-il-ri-annuncio-di-meloni) per la seconda volta un piano strutturale idrogeologico per affrontare tali emergenze (poi faranno i conti a casa col compagno).

Altro argomento de fuego: la maternità surrogata. Ieri è stata [approvata](https://www.ilfattoquotidiano.it/2023/07/26/maternita-surrogata-via-libera-della-camera-alla-legge-sul-reato-universale-il-testo-passa-al-senato/7243114/) alla Camera la legge, fortemente voluta dalla maggioranza, che la rende reato universale. Che fa molto ridere se non facesse piangere sia per la fattispecie scelta, come se l’Italia fosse l’ONU, ed anche per l’approssimazione del testo. Come sapete, anche io trovo un abominio chi affitta il proprio utero, ma chi vuole donarlo dovrebbe essere liberissimo di farlo. E purtroppo, questa legge accomuna rozzamente le due pratiche.

La ministra del Presepe e del Bambin Gesù, Eugenia Roccella, ha [assicurato](https://www.huffingtonpost.it/politica/2023/07/26/news/eugenia_roccella_il_reato_universale_della_gpa_serve_ad_aprire_un_dibattito_non_arresteremo_nessuno-13006520/): “Non puniremo nessuno, serve ad aprire una discussione”. Rassicurante quanto una cartella di Equitalia. Voglio però vederci una buona notizia, sono un'inguaribile ottimista. La prossima volta che chiunque dica che c’è ben altro a cui pensare come scusa per non legiferare in materia di diritti civili (scusa usata molto anche a sinistra), mi ricorderò che nel bel mezzo dell’Estate, con catastrofi bibliche che imperversano nel territorio, il Parlamento ha trovato il tempo di toglierli questi benedetti diritti. Se vale l’uno, vale pure l’altro.

Che altro sul fronte politico? Prendo una tangente micidiale, ma per dirvi che le classi al comando sono identiche in tutto il mondo. Siccome l’accusa che si fa a Santanché è quella di esser stata privilegiata nel suo trattamento giudiziario (come mai la notizia di reato è arrivata dopo mesi dall’accaduto? Ad un cittadino comune verrebbe riservato lo stesso trattamento con i guanti?), direi che non è la prima e non sarà l'ultima. Se ci spostiamo in America, il processo al figlio del presidente Joe Biden, Hunter, ha appena subìto un [colpo di scena](https://open.spotify.com/episode/6QzaFPMlvzMjivivScHmuo?si=Ik4MSKzjRsGV1Tfq96cC6g) shakespeariano. Mercoledì, l’uomo, accusato di evasione fiscale e di aver mentito sulla propria tossicodipendenza quando ha acquistato un’arma da fuoco, si è dichiarato NON colpevole davanti ad un giudice federale.

Questo è accaduto nonostante ci fosse un accordo con l’accusa affinché si dichiarasse colpevole, in cambio dell’amnistia sul reato di falsa dichiarazione in merito alla sua dipendenza. A cosa è dovuto il colpo di teatro? Pare che il giudice abbia messo in discussione la costituzionalità di tale accordo all’ultimo minuto. Eppure, la vera domanda è: come mai il caso è emerso solo dopo anni dal fatto stesso? Diverse audizioni parlamentari hanno messo sotto pressione i capi dell’agenzia di riscossione americana, l’IRS, anche se per ora rimane l’ombra del privilegio per via del nome.

Come vedete, tutto il mondo è paese.",Italia,1,10
44y8q8,Politici contro la maternità surrogata (con riserva),"Il nostro Ministro della Salute, Beatrice Lorenzin, ha rilasciato un'intervista a Repubblica per spiegare la sua posizione rispetto al ddl Cirinnà.

Il suo problema, come sappiamo, è la maternità surrogata / GPA / utero in affitto - che non rientra in alcun modo nella suddetta legge. Comunque...

Lorenzin afferma che la stepchild adoption apre la strada alla GPA e dunque allo sfruttamento dei paesi poveri, o meglio di quelle donne che pur di tirare avanti sono costrette a vendere il proprio utero e i bambini che partoriscono. Un esempio, dice il Ministro della Salute, è l'Ucraina.

Il Ministro dimentica però di specificare una cosa. I paesi di cui parla (cioè l'Ucraina, l'India e la Russia, ecc.) consentono la GPA esclusivamente alle **coppie eterosessuali** e, anzi, in quanto ad omofobia fanno invidia all'Italia.

Altro politico: Maurizio Gasparri. 

Elton John ospite del festival di Sanremo: è il male assoluto, è propaganda gay in favore dell'utero in affitto, è il diavolo, è satana, moriremo tutti a causa di Elton John.

L'altro ospite internazionale è Nicole Kidman. Bellissima, biondissima, magrissima, eterosessualissima. Tutto molto bello. Nessuno ha avuto da ridire sul fatto che Nicole Kidman e il marito abbiano avuto una figlia grazie alla maternità surrogata.

Ora, secondo voi è logico pensare che il problema di questi politici non sia tanto la GPA quanto il fatto che ad usufruirne possano essere anche gli omosessuali?
",italy,3,2
1gfzst5,"Il caso. Maternità surrogata, fermati due italiani in Argentina. Erano con la bimba e la madre surrogata nell'aeroporto di Buenos Aires pronti a imbarcarsi per Parigi. Nel nostro Paese dal 16 ottobre la gestazione per altri è reato universale",,oknotizie,93,63
u8xrk7,"Utero in affitto, ok al testo base: sì a proposta Meloni. ""La maternità surrogata come reato universale""",,italy,125,481
1duelis,Ok della commissione alla maternità surrogata come reato universale. Il testo pronto per l’Aula del Senato,,oknotizie,37,97
144zsvl,"Maternità surrogata, corsa delle coppie in Ucraina prima del ""reato universale""",https://www.repubblica.it/cronaca/2023/06/09/news/maternita_surrogata_corsa_ucraina_reato_universale-403745169/?ref=RHLF-BG-I403781104-P4-S1-T1,NotizieInteressanti,1,0
u9950q,"Utero in affitto, ok al testo base: sì a proposta Meloni. ""La maternità surrogata come reato universale""",,xxitaly,12,9
1g5wn6a,maternità surrogata ,"https://www.tgcom24.mediaset.it/politica/maternita-surrogata-reato-universale-che-cosa-cambia_88961516-202402k.shtml

cosa ne pensate? siete pro o contro? e perché? 
aperti i dibattiti ",CasualIT,0,1
1dufo25,"La maternità surrogata “una pratica indegna, che trasforma il corpo delle donne e la procreazione di bambini come merce da vendere al miglior offerente""",[https://www.repubblica.it/politica/2024/07/03/news/maternita\_surrogata\_reato\_universale\_senato\_testo\_significato-423355313/?ref=RHLF-BG-P1-S1-T1](https://www.repubblica.it/politica/2024/07/03/news/maternita_surrogata_reato_universale_senato_testo_significato-423355313/?ref=RHLF-BG-P1-S1-T1),NotizieInteressanti,1,3
144zw4i,"Commovente ""Poi abbiamo capito però che non volevamo lasciar morire i nostri embrioni congelati. Da qui la scelta della maternità surrogata. Nonostante la guerra. E il miracolo di due meravigliose figlie"".",https://www.repubblica.it/cronaca/2023/06/09/news/maternita_surrogata_corsa_ucraina_reato_universale-403745169/?ref=RHLF-BG-I403781104-P4-S1-T1,NotizieInteressanti,1,0
13raxzx,la maternità surrogata “offende in modo intollerabile la dignità della donna e mina nel profondo le relazioni umane”,https://www.repubblica.it/politica/2023/05/25/news/zagrebelsky_maternita_surrogata_reato_universale-401622113/?ref=RHLF-BG-I401656224-P6-S2-T1,NotizieInteressanti,1,0
13ppvww,"Purtroppo non conti niente. Maternità surrogata, Valente (Pd): ""Da femminista sono contraria""",https://www.repubblica.it/politica/2023/05/23/news/valente_zan_schlein_maternita_surrogata_reato_universale-401425457/?ref=RHLF-BG-I401434360-P6-S2-T1,NotizieInteressanti,1,0
141nx9j,"Roma Pride, Regione Lazio revoca patrocinio per edizione 2023: «No sostegno a chi promuove utero in affitto». Gualtieri: «Io in piazza»",,Italia,113,139
1g6fewa,Utero in affitto e diritti,"Utero in affitto...Chi tira fuori presunti diritti si dimentica quelli del nascituro e quello delle donne a non essere usate come incubatrici...  
[https://www.amicidilazzaro.it/it/bioetica-e-vita/lutero-in-affitto-e-il-contrario-delle-pari-opportunita/](https://www.amicidilazzaro.it/it/bioetica-e-vita/lutero-in-affitto-e-il-contrario-delle-pari-opportunita/)  
#gpa #uteroinaffitto #surrogacy #maternitasurrogata   
#gestazione  
  
  
  
",Bioetica,1,0
1d2g4qq,Utero in affitto o maternità surrogata - Franco Lisi ginecologo fertilità,,CentroSterilita_roma,1,0
1d2g4l7,Utero in affitto o maternità surrogata - Franco Lisi ginecologo fertilità,,Sterilita_fertilita,1,0
1bz4y0e,Utero in affitto o maternità surrogata - Franco Lisi ginecologo fertilità,,CentroSterilita_roma,1,0
1bz4xiq,Utero in affitto o maternità surrogata - Franco Lisi ginecologo fertilità,,Sterilita_fertilita,1,0
14gaw44,"Secondo il giornalista de Il Corriere ""Utero in affitto"" non si può dire",https://www.corriere.it/politica/23_giugno_22/cedu-boccia-ricorsi-riconoscere-subito-figli-coppie-gay-9bae657a-1111-11ee-a86b-4e8204e35ce8.shtml,NotizieInteressanti,1,0
16mn3uy,Destra e conservatorismo islamico,"Avete mai notato la somiglianza tra la destra e i conservatori musulmani?

- entrambi vedono il ruolo della donna come madre che deve accudire i figli

- entrambi ritengono la religione un qualcosa che va difeso

- sono contrari all' ""utero in affitto""

- non vedono di buon occhio i diritti lgbt

- sono entrambi contrari all'insegnamento di materie come educazione sessuale a scuola

Insomma fa ridere perché molti a destra parlano di non voler diventare uno stato islamico, ma hanno molto più in comune con loro di quanto non vogliano ammettere",Italia,118,362
45jo2b,Su La7 viene mandato in onda un video complottista sul gender/utero in affitto,,italy,11,40
wdaxbq,"Utero in affitto, la Baldassarre presenta il suo libro al Coccoloco il 2 agosto","&#x200B;

[ ](https://preview.redd.it/7iv1xqezw1f91.png?width=465&format=png&auto=webp&s=97c3431fb2df26fb128ee206c8e3252dea9f8187)

Martedì 2 agosto alle 19.00 al Coccoloco di Fregene ci sarà la presentazione del libro di **Simona Baldassarre “Il mondo di sotto. Donne sfruttate e bambini venduti”** sulla pratica dell’utero in affitto.

Insieme all’autrice, eurodeputato e responsabile del dipartimento famiglia della Lega, ci saranno l’onorevole **Claudio Durigon**, coordinatore Lega Lazio, **Stefano Calandra**, vice commissario Lega Fiumicino, **Sergio Pirozzi** consigliere regionale Lega, no, à **Tony Brugnolo** responsabile Lega Provincia Roma Sud, **Monica Picca**, commissario Lega Fiumicino, modera **Massimiliano Tommasi**.

 

https://preview.redd.it/z223p561x1f91.png?width=480&format=png&auto=webp&s=6dcc843a0c43acec9441cf5b94f965b2aac5d844

https://www.fregeneonline.com/utero-in-affitto-la-baldassarre-presenta-il-suo-libro-al-coccoloco-il-2-agosto/",Fiumicino,1,0
42c79a,"Mi spiegate i motivi per cui la pratica dell' ""utero in affitto"" è così malvista? (Almeno in Italia)","Premetto che non sono affatto esperto in materia e non voglio concentrarmi per forza sulla questione ""politica"".

Da quello che ho capito, in Italia e in altri stati europei la surrogazione di maternità (o utero in affitto) non è considerata legale. La mia domanda è: perchè? Quali sono i motivi per schierarsi contro questa pratica?

Solo a me non provoca alcun tipo di disgusto/orrore, nemmeno in forma lucrativa? 

Fatemi capire se mi sto perdendo qualche passaggio.



",italy,6,36
48mvw8,"Ma quanto costa un utero in affitto? Ho cercato qualche prezzo in giro e ho trovato una pagina di ""offerte""",,italy,10,25
qud348,Caso choc di utero in affitto: bimba “commissionata” e poi abbandonata,,events,1,0
pkyauc,Benvenuti alla Fiera dell&#x27;utero in affitto,,news_italia,1,0
5c6vvb,"Un articolo di Avvenire, dal titolo ""La legge violata dal legislatore"", su un senatore del PD che ha usato l' utero in affitto.",,italy,13,20
3w7hrw,"Utero in affitto: la faccia poco pubblicizzata del DL Cirinna', spesso nascosta dal ""matrimonio gay""",,italy,4,9
49huje,Ricci Sindoni: utero in affitto e femminicidio facce della stessa medaglia,,italy,1,8
4l00av,"Gestazione per altri, lo scandalo ""utero in affitto"" tra Cina e Giappone che ha molto da insegnare all'Italia",,Italia,2,7
9qn5s9,Utero in affitto : tutta la verità in 3 minuti,,oknotizie,3,0
9kggbf,Petizione globale di 89 associazioni. Utero in affitto mozione all’Onu per proibirlo,,oknotizie,3,0
11wqno4,Maternità surrogata: sì o no?,"Siete a favore o contrari alla maternità surrogata (utero in affitto)? 

Io sono totalmente a favore. Voi?",Italia,8,241
96exh8,"Utero in affitto, lo spot vietato tra i filmati web per bambini",,ultime_notizie,1,0
90wtsq,"Cristiano Ronaldo, solo i famosi possono usare l’utero in affitto?",,REPORT_ITALIANO,1,0
8whekd,Utero in affitto: il Comune di Roma ammette il reato,,oknotizie,2,0
8vhg4r,"Caro Salvini, l’utero in affitto farà ‘schifo’ ma difendere la famiglia naturale non conviene neanche a te",,REPORT_ITALIANO,1,0
8k24iy,"Patriarcato, fellatio, islam, utero in affitto: a 50 anni dal maggio francese parla la femminista che fu nel Movimento di liberazione",,REPORT_ITALIANO,1,0
8impcn,"Utero in affitto, illegale ma sdoganato con la complicità dei sindaci: ecco chi sono",,REPORT_ITALIANO,1,0
8h6i0c,“Papà” Vendola all’attacco di Meloni e Salvini: «Italiani favorevoli all’utero in affitto»,,REPORT_ITALIANO,1,0
84v6og,Tiziano Ferro papà (o mammo) con l’utero in affitto? “Giallo” sulla foto pubblicata,,REPORT_ITALIANO,1,0
82wb4b,Meloni: «Festeggiamo la donna combattendo la barbarie dell’utero in affitto»,,REPORT_ITALIANO,1,0
80ljxf,"Meloni: «No all’utero in affitto, incivile vedere due gay “comprare” bambini»",,REPORT_ITALIANO,1,0
7yndpz,"Meloni: l’utero in affitto? Barbarie, deve diventare reato universale",,REPORT_ITALIANO,1,0
7ri60x,"Utero in affitto, un abominio criminale - Diego Fusaro",,oknotizie,2,0
7urkyd,"Meloni: ""Utero in affitto sia reato universale""",,REPORT_ITALIANO,1,0
7ur3fr,La Boldrini apre anche all’utero in affitto. È bufera: «Non sai di che parli»,,REPORT_ITALIANO,1,0
7uq6rd,"Utero in affitto, Avvenire contro la Boldrini: «Ambiguità inaccettabile»",,REPORT_ITALIANO,1,0
7ghpad,La ricerca (voluta dalle donne): italiani divisi sull’utero in affitto,,REPORT_ITALIANO,1,0
61ip2p,"Susanna Tamaro: «Utero in affitto, non in mio nome»",,italypremium,1,0
5wunha,Un tribunale riconosce figli da utero in affitto ad una coppia gay. Praticamente: bambini in svendita!,,italypremium,1,0
5wred2,Indifferenti ai diritti: sul fine vita e utero in affitto il governo gioca a nascondino e il Parlamento è bloccato da anni,,italypremium,1,0
5wp545,"Trento, gemelli nati da utero in affitto hanno due padri: la sentenza",,italypremium,1,0
5su1cx,Adinolfi e Sentinelle in Piedi contro Sanremo: ‘Il festival promuove l’utero in affitto’,,italypremium,1,0
5q2w92,"Utero in affitto, dall'Europa l'ennesimo no: ""Per la maternità serve legame biologico""",,italypremium,1,0
5c6w9n,"Un articolo di Avvenire, dal titolo ""La legge violata dal legislatore"", su un senatore del PD che ha usato l' utero in affitto.",,italypremium,1,0
4x7jtr,"Utero in affitto, i genitori rifiutano di pagare: «Il bimbo è brutto»",,italypremium,1,0
19es6ju,donne,"Se discuti di femmismo civilmente, se denunci tutte le pazzie dette dalla lega e fdi su aborto, utero in affitto, femminicidio e catcalling, sei una pazza isterica con i capelli colorati da chiudere in manicomio con i polsi legati o con la camicia di forza! Se ti ritieni intelligente e su come risolvere la violenza di genere, sei etichettata come una strega, una misandrica, e un’ utente di twitter incazzata con i maschi bianchi etero cis Intanto, mentre la Germania fa le proteste contro l’estrema destra, noi italiani a sentire in tv in prima serata e al giornale che la massima aspirazione di una donna è essere una madre, e che l’aborto non è un diritto! E noi donne e ragazze ci dobbiamo accontentare di tutto ciò che abbiamo fatto negli ultimi 50 anni, “hai i tuoi diritti, accontentati!” Io non sto zitta e non mi accontento, i miei diritti non sono i croccantini al gatto per farlo stare zitto! Per tutto questo ho ricevuto insulti da quella parola con la R riferita ai disabili e che in quanto donna “il tuo compito è quello di stare a casa a partorire bambini coloro che saranno i futuri soldati” boh?? Anche minacce di essere legata da un palo e data fuoco, come quel cane di Palermo! Anche tante belle accuse di essere una fascista dalla camicia nera appesa come un salame! Se stiamo zitte, nulla cambia Se protestiamo, riceviamo le manganellate in faccia e dritte in ospedale! Chiamatemi una fascia misadrica con i capelli blu, non me ne fotte niente, perché ne ho subito abbastanza a questo martirio! Insultatemi quando volete, se questa è la vostra libertà di pensiero e dibattito! Se sto zitta è un male Se parlo è un male lo stesso!",copypastaitalia,5,2
